{
  "schema_version": "1.0.0",
  "generated_at": "2026-07-14T15:51:51Z",
  "source_commit": "200665bd9eb5d9393011f8c3d9a3c31001b8cf15",
  "source_paths": [
    "docs/quantmind2/context/COMPONENT_CATALOG.md",
    "docs/quantmind2/architecture/QUANTMIND_2_ARCHITECTURE_V1.md"
  ],
  "authority_level": "derived_catalog",
  "freshness_status": "current_at_base_commit",
  "verification_status": "verified",
  "components": [
    {
      "component_id": "quantmind.training", "name": "Existing LightGBM Training", "status": "implemented",
      "responsibility": "Build LightGBM training configuration, run containerized training, and emit model artifacts.",
      "source_path": "backend/services/engine/training", "target_path": "backend/services/engine/training",
      "key_symbols": ["LocalDockerOrchestrator", "load_data", "train_model"], "dependencies": ["quantmind.feature_snapshots"],
      "architecture_decision_refs": ["ADR-0004", "ADR-0007", "ADR-0008"],
      "current_limitations": ["Model metadata does not lock QuantMind 2.0 Factor Instance and Materialization identities.", "Declared label_formula does not control the actual label implementation."],
      "last_verified_commit": "e9b0c7d5d00a870a687fc2daeb3c7aa64a0e2e08", "evidence_level": "code_confirmed"
    },
    {
      "component_id": "quantmind.inference", "name": "Existing Model Inference", "status": "implemented",
      "responsibility": "Load registered models and produce predictions from prepared features.",
      "source_path": "backend/services/engine/inference", "target_path": "backend/services/engine/inference",
      "key_symbols": ["ModelLoader", "DataAdapter", "InferenceService"], "dependencies": ["quantmind.training"],
      "architecture_decision_refs": ["ADR-0004", "ADR-0007"], "current_limitations": ["Unified Signal Artifact integration is not implemented."],
      "last_verified_commit": "e9b0c7d5d00a870a687fc2daeb3c7aa64a0e2e08", "evidence_level": "code_confirmed"
    },
    {
      "component_id": "quantmind.qlib_backtest", "name": "Existing Qlib Backtest", "status": "implemented",
      "responsibility": "Execute official Qlib strategies, exchange simulation, portfolio backtest, and persistence.",
      "source_path": "backend/services/engine/qlib_app", "target_path": "backend/services/engine/qlib_app",
      "key_symbols": ["QlibBacktestService", "QlibBacktestServiceRuntimeMixin", "StrategyFactory"], "dependencies": ["quantmind2.signal_service"],
      "architecture_decision_refs": ["ADR-0004", "ADR-0006"], "current_limitations": ["Dataset Snapshot and Unified Signal lineage are not yet first-class inputs."],
      "last_verified_commit": "e9b0c7d5d00a870a687fc2daeb3c7aa64a0e2e08", "evidence_level": "code_confirmed"
    },
    {
      "component_id": "quantmind.risk", "name": "Existing Risk Analysis", "status": "implemented",
      "responsibility": "Analyze official Qlib portfolio and trade results.",
      "source_path": "backend/services/engine/qlib_app/services/risk_analyzer.py", "target_path": "backend/services/engine/qlib_app/services/risk_analyzer.py",
      "key_symbols": ["RiskAnalyzer"], "dependencies": ["quantmind.qlib_backtest"],
      "architecture_decision_refs": ["ADR-0004", "ADR-0006"], "current_limitations": ["QuantMind 2.0 Experiment lineage is not recorded."],
      "last_verified_commit": "e9b0c7d5d00a870a687fc2daeb3c7aa64a0e2e08", "evidence_level": "code_confirmed"
    },
    {
      "component_id": "quantmind.feature_snapshots", "name": "Feature Snapshots", "status": "partial",
      "responsibility": "Produce annual Parquet matrices consumed by existing training.",
      "source_path": "scripts/data/rebuild_v2/build_feature_snapshots.py", "target_path": "backend/services/engine/factor_research/features",
      "key_symbols": ["add_daily_technical_features"], "dependencies": ["quantmind2.data_foundation", "quantmind2.factor_registry"],
      "architecture_decision_refs": ["ADR-0003", "ADR-0004", "ADR-0007"], "current_limitations": ["No immutable Dataset Snapshot or Factor Registry lineage."],
      "last_verified_commit": "e9b0c7d5d00a870a687fc2daeb3c7aa64a0e2e08", "evidence_level": "code_confirmed"
    },
    {
      "component_id": "factor_lab.official_v7_source", "name": "Official V7 Factor Lab Source", "status": "partial",
      "responsibility": "Read-only donor for Agent, Candidate, Docker sandbox, validation, campaign, and Research Memory capabilities.",
      "source_path": "/tmp/quantmind_factor_lab_real_bounded_v7_orchestrator_v1/backend/services/engine/factor_lab/", "target_path": "backend/services/engine/factor_research",
      "key_symbols": ["FactorSpec", "CodexRunner", "CandidateManifest", "ExecutionBackendGateway", "DockerSandboxBackend", "AntiOverfitEvaluator", "MemoryStore"],
      "dependencies": ["quantmind.qlib_backtest"], "architecture_decision_refs": ["ADR-0001", "ADR-0002", "ADR-0005", "ADR-0006", "ADR-0009"],
      "current_limitations": ["Python-first candidate contract.", "Agent selects structure and concrete parameters together.", "No formal ResearchDecision or Decision Validator boundary.", "Campaign and research drivers combine decision, loop-control, dispatch, and feedback roles.", "JSON registry is replaceable.", "Source resides under /tmp.", "No target Factor Optimization or Frozen Test isolation."],
      "last_verified_commit": "c83192c2278767e03f008bc39197b1ba33bfb6a9", "evidence_level": "code_confirmed"
    },
    {
      "component_id": "quantmind2.project_knowledge", "name": "Project Knowledge", "status": "partial",
      "responsibility": "Provide repository context, ADRs, implementation contracts, validation, and later API/web indexes.",
      "source_path": "backend/services/engine/project_knowledge/domain", "target_path": "backend/services/api/project_knowledge",
      "key_symbols": ["ImplementationTask", "ImplementationRun", "LedgerRepository", "TaskQuery", "RunQuery", "HistoryQuery", "InMemoryLedgerRepository", "validate_direct_relationship"], "dependencies": [],
      "architecture_decision_refs": ["ADR-0001", "ADR-0005", "ADR-0007", "ADR-0009"], "current_limitations": ["Pure domain and Repository contracts plus an in-memory test double exist, but SQLAlchemy Repository, ORM model, PostgreSQL schema/tables, migration, Manifest Indexer, Git consistency service, API, and web UI remain planned.", "The in-memory test double is process-local, non-durable, non-concurrent, and cannot certify PostgreSQL transactions.", "Context schema v1 cannot represent exact next task QM2-P0-002A2 and retains parent QM2-P0-002 in machine-readable task lists."],
      "last_verified_commit": "200665bd9eb5d9393011f8c3d9a3c31001b8cf15", "evidence_level": "code_confirmed"
    },
    {
      "component_id": "quantmind2.research_skill", "name": "Research Skill", "status": "planned",
      "responsibility": "Apply research method and economic reasoning to visible evidence and emit ResearchDecision proposals.",
      "source_path": null, "target_path": "backend/services/engine/factor_research/skills",
      "key_symbols": [], "dependencies": ["quantmind2.decision_validator"],
      "architecture_decision_refs": ["ADR-0005", "ADR-0006", "ADR-0009"],
      "current_limitations": ["Architecture contract only; no Skill runtime, prompt package, permission identity, or execution integration is implemented."],
      "last_verified_commit": null, "evidence_level": "planned"
    },
    {
      "component_id": "quantmind2.decision_validator", "name": "Decision Validator", "status": "planned",
      "responsibility": "Validate ResearchDecision schema, permission, state, budget, duplication, evidence visibility, and Frozen Test restrictions before Run creation.",
      "source_path": null, "target_path": "backend/services/engine/factor_research/control/decision_validator",
      "key_symbols": [], "dependencies": ["quantmind2.experiment_manager"],
      "architecture_decision_refs": ["ADR-0006", "ADR-0007", "ADR-0009"],
      "current_limitations": ["JSON Schema and architecture contract exist; no executable validator, policy store, or permission enforcement is implemented."],
      "last_verified_commit": null, "evidence_level": "planned"
    },
    {
      "component_id": "quantmind2.code_orchestrator", "name": "Bounded Code Orchestrator", "status": "planned",
      "responsibility": "Own persistent loop state, permissions, budgets, idempotency, concurrency, Run/Artifact coordination, deterministic dispatch, retries, timeouts, and recovery.",
      "source_path": null, "target_path": "backend/services/engine/factor_research/control/orchestrator",
      "key_symbols": [], "dependencies": ["quantmind2.decision_validator", "quantmind2.experiment_manager"],
      "architecture_decision_refs": ["ADR-0007", "ADR-0008", "ADR-0009"],
      "current_limitations": ["Target responsibilities are accepted but no QuantMind 2.0 runtime implementation exists; V7 BoundedCampaignRunner and BoundedV7SessionOrchestrator are donor evidence, not compliant implementation."],
      "last_verified_commit": null, "evidence_level": "planned"
    },
    {
      "component_id": "quantmind2.data_foundation", "name": "Data Foundation", "status": "planned", "responsibility": "TongDaXin ingestion, immutable raw data, normalization, quality, Dataset Snapshot, and consumer views.",
      "source_path": null, "target_path": "backend/services/engine/data_foundation", "key_symbols": [], "dependencies": [], "architecture_decision_refs": ["ADR-0003"],
      "current_limitations": ["Not implemented; concrete TongDaXin provider is unverified."], "last_verified_commit": null, "evidence_level": "planned"
    },
    {
      "component_id": "quantmind2.factor_dsl", "name": "Factor DSL", "status": "planned", "responsibility": "Canonical AST, parameter nodes, validation, canonicalization, and hashing.",